{
  "id": "white-cards",
  "name": "White answer cards",
  "format_id": "standard",
  "author": "Cards Against Humanity LLC",
  "cards": {
    "white_01": 1,
    "white_02": 1,
    "white_03": 1,
    "white_04": 1,
    "white_05": 1,
    "white_06": 1,
    "white_07": 1,
    "white_08": 1,
    "white_09": 1,
    "white_10": 1,
    "white_11": 1,
    "white_12": 1,
    "white_13": 1,
    "white_14": 1,
    "white_15": 1,
    "white_16": 1,
    "white_17": 1,
    "white_18": 1,
    "white_19": 1,
    "white_20": 1,
    "white_21": 1,
    "white_22": 1,
    "white_23": 1,
    "white_24": 1,
    "white_25": 1,
    "white_26": 1,
    "white_27": 1,
    "white_28": 1,
    "white_29": 1,
    "white_30": 1,
    "white_31": 1,
    "white_32": 1,
    "white_33": 1,
    "white_34": 1,
    "white_35": 1,
    "white_36": 1,
    "white_37": 1,
    "white_38": 1,
    "white_39": 1,
    "white_40": 1
  },
  "notes": "Versioned answer-card supply for the Forge party-table setup."
}
